{
  "task_id": "TASK-V3-VISUAL-P022",
  "execution_kind": "HOST_AGENT",
  "executor": {
    "kind": "HOST_AGENT",
    "host": "pi",
    "host_version": "UNKNOWN",
    "provider": "openai-codex",
    "model": "gpt-6-sol",
    "model_version": "UNKNOWN",
    "reasoning_profile": "high",
    "tool_profile": "paper-only",
    "started_at": "2026-10-04T03:00:00+00:00",
    "completed_at": "2026-10-04T03:00:00+00:00"
  },
  "started_at": "2026-10-04T03:00:00+00:00",
  "completed_at": "2026-10-04T03:00:00+00:00",
  "input_hashes": {
    "source/paper.pdf": "e9a0d3128767db616085dc0f4e6e455e672e89af823e8ed1282793682787395a",
    "source_pages/page-022.png": "0a30e2c0529893c5fd2f8ea1a97295bfb2bd6d5d39bde3e8894383beae7ad7f0",
    "model/figure_inventory.json": "75a2c38fb10537e2939e3f85c339309fedd862dc7781f797bffbbdaf49d69afa"
  },
  "contract_version": "3.0",
  "prompt_version": "3.0",
  "result": {
    "schema_version": "1.0",
    "source_sha256": "e9a0d3128767db616085dc0f4e6e455e672e89af823e8ed1282793682787395a",
    "page": 22,
    "bindings": [
      {
        "evidence_id": "T14",
        "kind": "table",
        "bbox_norm": [
          0.16830065359477125,
          0.44257377855705493,
          0.666784747753268,
          0.8296595101404671
        ],
        "status": "VERIFIED",
        "complete": true,
        "caption_match": true,
        "confidence": 0.9,
        "notes": "Full-page visual inspection confirmed complete semantic region and caption match; overlapping geometry candidate corrected where needed."
      }
    ]
  }
}
