{
  "task_id": "TASK-V3-DIRECT-UNSEEN-01-RETHINKING-GENERALIZATION",
  "execution_kind": "HOST_AGENT",
  "executor": {
    "kind": "HOST_AGENT",
    "host": "pi",
    "host_version": "frozen-v3",
    "provider": "magpie",
    "model": "antigravity/gemini-3.8-flash",
    "model_version": "canonical-high",
    "reasoning_profile": "high",
    "tool_profile": "paper-only",
    "started_at": "2026-10-05T14:33:56.822658+00:00",
    "completed_at": "2026-10-05T14:33:56.822658+00:00"
  },
  "started_at": "2026-10-05T14:33:56.822658+00:00",
  "completed_at": "2026-10-05T14:33:56.822658+00:00",
  "input_hashes": {
    "source/paper.pdf": "a71f1294a021cebc6939ec977fc073b6d7b4f183950eba761ec55364d30b729f"
  },
  "contract_version": "3.0",
  "prompt_version": "3.0",
  "result": {
    "schema_version": "1.0",
    "paper_id": "UNSEEN-01-RETHINKING-GENERALIZATION",
    "source_sha256": "a71f1294a021cebc6939ec977fc073b6d7b4f183950eba761ec55364d30b729f",
    "narrative_markdown": "# Understanding deep learning requires rethinking generalization — 直接精读报告\n\n## 1. 论文的原生论证结构与核心命题\n\n本研究是一篇在机器学习理论与统计学习哲学上具有颠覆性质的“理论构造证明与反事实经验证伪”相结合的奠基之作。作者并未遵循工程模型论文中常见的“发现痛点 → 提出架构组件 → 报告基准分数SOTA → 消融实验”的套路，而是构造了一个直击现代深度学习基础的认知悖论（Paradox）：\n\n**核心命题（Thesis）：** 深度神经网络巨大的有效表达容量（Effective Capacity）足以蛮力记忆（Brute-force Memorization）完全随机标记的训练样本，同时优化算法（SGD）在随机标记下的收敛难度仅发生常数级别的衰减；而传统统计学习理论（VC维、Rademacher复杂度、一致稳定性）的经典泛化界完全无法区分“真实数据上良好泛化的网络”与“随机数据上彻底过拟合的网络”。因此，解释深度学习的泛化能力必须从根本上反思经典泛化理论框架。\n\n论文的推演逻辑呈现出鲜明的五步递进链条：\n1. **反事实数据扰动设计**：将非参数统计中的随机化测试（Randomization Tests）引入深度网络训练，分别施加标签随机化与像素扰动；\n2. **反常经验现象观察**：标准卷积架构（Inception、AlexNet）与多层感知机（MLP）在随机标签上依然无阻碍达到 0 训练误差（100% 训练准确率）；\n3. **显式正则化的必要性证伪**：数据增强、权重衰减（Weight Decay）、Dropout 等显式正则项对泛化虽有微调增益，但既非泛化控制的充分条件，亦非必要条件；\n4. **有限样本表达力定理构造**：通过构造性证明给出严密的理论支撑（定理1），仅需 $p = 2n + d$ 个参数的简单双层 ReLU 网络即可完美拟合任意包含 $n$ 个样本的任意离散标签；\n5. **传统统计泛化理论的失效剖析**：系统论证为何基于假设空间大小的经典复杂度度量以及算法一致稳定性均无法解释泛化，最终将解释支点指向优化算法的隐式正则化与数据几何特性。\n\n---\n\n## 2. 关键经验证伪：随机化检验与反事实对照实验\n\n为严格分离“网络对真实自然图像语义特征的提取能力”与“网络参数空间的记忆容量”，论文在 CIFAR-10 和 ImageNet 上设计了一组渐进破坏数据结构的对照实验（Sec 2.1）：\n\n1. **真实标签（True labels）**：原始未修改基准；\n2. **完全随机标签（Random labels）**：对所有训练样本均匀随机重新赋予类别标签，测试集保持不变；\n3. **部分破坏标签（Partially corrupted labels）**：以概率 $p \\in (0, 1)$ 将真实标签替换为随机标签；\n4. **打乱像素（Shuffled pixels）**：在所有图像上施加同一个全局随机空间像素排列，保留所有边际像素分布但破坏空间相关性；\n5. **随机像素（Random pixels）**：每张图像独立施加独立同分布的随机像素置换；\n6. **高斯噪声（Gaussian noise）**：直接使用均值方差匹配的高斯白噪声替代输入图像。\n\n### 决定性实证证据解读\n\n- **Figure 1a（训练损失收敛轨迹，p.4）**：Figure 1a 显示，无论是真实标签、完全随机标签、打乱像素还是高斯噪声，Inception 网络在 CIFAR-10 上经过约 10k ~ 25k 步训练后，**平均交叉熵训练损失均全部收敛至 0**。这表明卷积局部连接与参数共享的归纳偏置（Inductive Bias）根本无法约束网络去拒绝纯噪声。\n- **Figure 1b（过拟合时间减缓因子，p.4）**：随着标签损坏率从 0.0 渐进上升至 1.0，Inception 和 AlexNet 达到 100% 训练精度的时间仅延长了约 2 ~ 4 倍（常数级倍数）。这直接击碎了“虽然网络容量大，但在随机噪声上非凸优化极其困难而无法收敛”的直觉假设——**即使在没有任何信号的随机流形上，梯度下降依然能够极其高效地找到全局经验风险零点**。\n- **Figure 1c 与 Table 1（泛化能力随噪声水平的衰退，p.4 & p.6）**：\n  在 CIFAR-10 上，标签损坏率 $p$ 与测试误差呈现出近乎线性的平滑单调退化。Table 1 记录的详尽指标表明：\n  - Inception 在真实标签下：训练准确率 100%，测试准确率 89.05%；\n  - Inception 在完全随机标签下：训练准确率仍为 **100%**，而测试准确率骤降至 **10.00%**（完全等同于10类随机猜测）；\n  - 即使完全移除权重衰减与 Dropout 等正则项，Inception 依然取得 86.03% 的优良测试准确率；而在随机标签下依旧达到 100% 训练精度。\n- **Table 2（ImageNet 规模验证，p.13）**：在包含 128 万图像、1000 类的 ImageNet 巨型数据集上，Inception v3 在完全随机标签下达到 91.18% top-1 / 97.90% top-5 训练准确率，再次证明这一记忆现象绝非小数据集的特例，而是过参数化深度网络的通性。\n\n---\n\n## 3. 理论框架：有限样本表达力定理（Finite Sample Expressivity）\n\n为了避免学术界将上述实验归咎于复杂的非凸优化启发式，论文在 Section 3 中给出了一个深刻而优雅的理论构造，彻底厘清了过参数化网络拟合能力的理论下界。\n\n### 定理 1（Theorem 1, p.8）的精确表述与证明机制\n\n**定理内容：** 存在一个深度为 2 的前馈 ReLU 神经网络，隐藏层包含 $n$ 个神经元，输入维度为 $d$，总参数量为 $p = 2n + d$；对于任意包含 $n$ 个互不相同的样本点 $S = \\{x_1, \\dots, x_n\\} \\subset \\mathbb{R}^d$ 以及对应的任意标量目标值 $\\{y_1, \\dots, y_n\\} \\subset \\mathbb{R}$，该网络均可实现完美插值：\n$$f(x_i) = y_i, \\quad \forall i = 1, \\dots, n$$\n\n**构造逻辑拆解：**\n1. **输入投影降维**：通过选择一个随机单位向量 $a \\in \\mathbb{R}^d$，将高维点集 $\\{x_i\\}$ 投影到标量实数轴 $z_i = a^\top x_i$。由于样本点彼此互不相同，只要 $a$ 不与任意两点差向量的正交超平面重合，即可保证一维投影点 $\\{z_i\\}$ 严格单调互异（例如排序为 $z_1 < z_2 < \\dots < z_n$）；\n2. **隐藏层步长构造**：选取阈值参数 $b_i = z_i$，隐藏神经元计算 ReLU 激活 $h_j(x) = \\max\\{a^\top x - b_j, 0\\}$；\n3. **三角阵线性求逆**：在评估点矩阵 $M_{ij} = \\max\\{z_i - z_j, 0\\}$ 中，当 $i \\le j$ 时 $M_{ij} = 0$，当 $i > j$ 时 $M_{ij} = z_i - z_j > 0$。因此矩阵 $M$ 严格为对角线为 0 的下三角矩阵。添加常数偏置后，该线性方程组必然存在唯一解权重向量 $w \\in \\mathbb{R}^n$，使得输出层线性组合精确拟合任意目标值向量 $y$。\n\n**定理的理论分水岭意义：**\n以往在函数空间中关于网络深度的分离理论（如 Telgarsky, Eldan & Shamir）均建立在无限紧致集上的 $L^2$ 逼近范式上；而定理 1 明确指出：**在离散有限训练集上，甚至无需深度网络，仅参数量为 $O(n)$ 的极简双层单隐层网络就已经具备记忆任意样本标签的全部能力**。\n\n---\n\n## 4. 显式正则化与传统理论的局限性剖析\n\n### 显式正则项的非必要性（Sec 4, p.6-7）\n在传统统计学习（如 SVM、核方法）中，正则化是防止假设空间退化为平凡插值的数学支柱。然而论文通过系统的剥离实验证明：\n- 即使完全停用数据增强（Data Augmentation）、权重衰减（Weight Decay）和 Dropout，所有测试架构依然在真实 CIFAR-10 上达到极高泛化水准（如 Inception 达 86.03%）；\n- 正则化技术在深度学习中本质上是“超参数调优旋钮（Tuning Knobs）”，其主要作用在于稳定优化动态、提供几个百分点的精度润色，但并非决定泛化是否发生的决定性机制。\n\n### 传统理论三巨头的失效（Sec 5, p.9-10）\n1. **VC 维（Vapnik-Chervonenkis Dimension）**：分类器族容量界 $O(p \\log p)$，其中 $p$ 为参数量。现代网络 $p \\gg n$，导致 VC 维界呈现平凡上界（$\\gg 1$），无法预测泛化；\n2. **Rademacher 复杂度（Rademacher Complexity）**：理论上衡量假设空间拟合纯随机扰动标记的能力：\n   $$\\hat{\\mathcal{R}}_S(\\mathcal{H}) = \\mathbb{E}_\\sigma \\left[ \\sup_{h \\in \\mathcal{H}} \frac{1}{n} \\sum_{i=1}^n \\sigma_i h(x_i) \right]$$\n   实验表明，对于常用神经网络架构空间 $\\mathcal{H}$，经验 Rademacher 复杂度极其接近 1（因为能以 0 误差拟合纯随机标签 $\\sigma$）。任何基于 $\\sup_{h \\in \\mathcal{H}}$ 的一致收敛界（Uniform Convergence Bounds）在此类假设空间上都会得出完全无意义的泛化误差上界；\n3. **一致稳定性（Uniform Stability）**：Bousquet & Elisseeff 提出的一致稳定性要求训练集扰动一个样本时损失波动严格受控于 $O(1/n)$。但由于网络能够记忆任意噪声样本，改变单个标签会导致局部梯度与收敛点发生剧烈变动，算法在最坏情况下并不具备一致稳定性。\n\n---\n\n## 5. 事实边界、作者声称校准与未决张力\n\n### 证据确立的事实（Justified Findings）\n- 过参数化神经网络在当前梯度优化算法下，具备强行记忆任意大小规模标签的完全自由度，且该过程在优化计算上并不存在屏障；\n- 泛化性能的优劣不能归功于模型参数量少或显式正则化项的惩罚；\n- 独立于数据分布的“最坏情况（Worst-case）”假设空间理论彻底无法适用于深度学习。\n\n### 未完全解决的张力与作者声称的边界（Unresolved Tensions & Caveats）\n1. **隐式正则化的数学本质未明**：论文明确指认 SGD 的更新轨迹与权重初始化分布带来了隐式正则化（Implicit Regularization），但并未给出该隐式正则项的解析闭式解或可计算泛化界；\n2. **真实数据流形的作用机制**：尽管打乱像素会减缓收敛，但在随机像素上网络依然可拟合。自然图像的低维几何结构（Low-dimensional manifold）究竟如何与 SGD 协同以防止过拟合，论文仅作概念性提出，未建立定量判据；\n3. **线性模型与核方法的反向映射（Table 3, p.14）**：论文附录在核方法上展示了求解最小范数解同样能实现零训练误差并良好泛化，提示过参数化插值可能是更广泛的现象（后续间接启发了双重下降理论），但在深度非线性动力学中的延伸机制在此处尚未闭环。\n\n---\n*总结：本篇精读严格基于论文正文与附录原文证据，系统梳理了其“经验反常 → 理论定理 → 范式证伪 → 未决问题”的完整学术拓扑，确认其对传统学习理论最坏情况假设的根本性重塑。*",
    "notes": "Formal Gemini-3.8-flash direct reading baseline following frozen protocol Condition A prompt."
  }
}
